"SEC-CAT-LMF-024","EHRI must be able to register and safely report each access to the records of a patient/person, complying with the following requirements: 1. Identify all users who have accessed or modified the records of a patient/person in a given period. 2. Provide functionality to inform for a given user: • The records you can access. • You can access the specific sections of the registration(s). • The privileges you have concerning each of these records. 3. Identify all patients/people whose records have been accessed or modified by a specific user in a given period. 4. The system must generate a security event in case of an attempt or potential success for violating the login controls.","HIPAA §164.312(b), ISO/IEC 27002:2022 5.10","Sí","Permite trazabilidad completa de accesos a ePHI por usuario y paciente.","Alta","","38.32","0.65-SEC-CAT-IAF-002","76.58"
"SEC-CAT-LMF-025","The application must notify the administrator, audit, and record the modifications made in the application configuration.","NIST SP 800-53 AU-12(3), ISO/IEC 27002:2022 5.10","Sí","Configurar trazabilidad de cambios para evitar alteraciones no autorizadas.","Alta","","-12.45","0.66-SEC-CAT-LMF-030","45.89"
"SEC-CAT-LMF-026","The application must notify the system administrators and system security officers (ISSO) of account activation actions. The application must be configured to send notifications to the system administrator and the ISSO when application accounts are enabled.","ISO/IEC 27002:2022 5.18","Sí","Transparencia en acciones críticas de gestión de cuentas.","Alta","","2.44","0.89-SEC-CAT-LMF-27","61.61"
"SEC-CAT-LMF-027","The application must notify the system administrators and system security officers (ISSO) of account deactivation actions. The application must be configured to send notifications to the system administrator and the ISSO when application accounts are enabled.","ISO/IEC 27002:2022 5.18","Sí","Evita desactivaciones no autorizadas sin supervisión.","Alta","","2.44","0.91-SEC-CAT-LMF-029","61.61"
"SEC-CAT-LMF-028","The application must notify the system administrators and the system security officers (ISSO) when application accounts are created.","ISO/IEC 27002:2022 5.18","Sí","Control estricto de creación de nuevas cuentas de usuario.","Alta","","-6.02","0.89-SEC-CAT-LMF-030","46.50"
"SEC-CAT-LMF-029","The application must notify the system administrators and system information security officers (ISSO) of account elimination actions. The application configuration must include notification to the system administrator and the ISSO when application accounts are deleted.","ISO/IEC 27002:2022 5.18","Sí","Evita eliminación silenciosa de cuentas que afecten trazabilidad.","Alta","","-13.98","0.91-SEC-CAT-LMF-027","46.01"
"SEC-CAT-LMF-030","The application must notify system administrators and system security officers (ISSO) when user accounts are modified.","ISO/IEC 27002:2022 5.18","Sí","Mantiene trazabilidad de cambios sobre privilegios o atributos de cuentas.","Alta","","-3.99","0.89-SEC-CAT-LMF-028","47.50"
"SEC-CAT-LMF-031","The application must provide functions to analyze records and audit traces to identify all users who have accessed or modified patient/people records during a certain period.","HIPAA §164.312(b), ISO/IEC 27002:2022 5.10","Sí","Permite investigaciones retrospectivas efectivas.","Alta","","11.25","0.67-SEC-CAT-LMF-008","58.81"
"SEC-CAT-LMF-032","The application must alert the Information Security Officer (ISSO) and the System administration (SA) in case of a failure in audit processing. The application must be configured to send an alarm when the audit system fails or is experiencing failure.","NIST SP 800-53 AU-5, ISO/IEC 27002:2022 5.10","Sí","Fallas en auditoría deben ser notificadas inmediatamente.","Alta","","25.8","0.71-SEC-CAT-LMF-028","68.95"
"SEC-CAT-SRF-001","The application must implement protection measures to prevent SSRF vulnerabilities, including network and application layer controls.","OWASP Top 10 2021 A10, CWE-918","Sí","Previene explotación de servicios internos por SSRF.","Alta","","-12.45","0.53-SEC-CAT-IND-018","45.89"
