ID,Descripción
SEC-CAT-LMF-017,"The application must maintain audit records for a specific period of time, determined by regulations and medical standards. This retention must cover from 7 to 75 years, depending on the information and legal requirements of the State. Some states may require that medical records be preserved in the hospital to guarantee continuous accessibility."
SEC-CAT-LMF-018,"The LOG management application must ensure access and protect against unauthorized modification delete, and guarantee the integrity of audit tools to prevent improper use or commitment."
SEC-CAT-LMF-019,"The application must implement strict control measures for the elimination, replication, and consultations of audit records, ensuring total control over the entry, reading, manipulation, or data disposal."
SEC-CAT-LMF-020,"The application must transfer audit records to a system or medium different from the audited system and be configured to write application records in a centralized repository."
SEC-CAT-LMF-021,"The application must allow the review and centralized analysis of audit records with filtering options defined by the organization."
SEC-CAT-LMF-022,"At least one application administrator must be registered to receive notifications of updates or safety alerts when they are automatically available. Administrators must register to receive update notifications, allowing them to stop and update applications and components of the application."
SEC-CAT-LMF-023,"The application must generate audit records when a concurrent session is produced from different workstations."
SEC-CAT-LMF-024,"EHRI must be able to register and safely report each access to the records of a patient/person, complying with the following requirements: 1. Identify all users who have accessed or modified the records of a patient/person in a given period. 2. Provide functionality to inform for a given user: • The records you can access. • You can access the specific sections of the registration(s). • The privileges you have concerning each of these records. 3. Identify all patients/people whose records have been accessed or modified by a specific user in a given period. 4. The system must generate a security event in case of an attempt or potential success for violating the login controls."
SEC-CAT-LMF-025,"The application must notify the administrator, audit, and record the modifications made in the application configuration."
SEC-CAT-LMF-026,"The application must notify the system administrators and system security officers (ISSO) of account activation actions. The application must be configured to send notifications to the system administrator and the ISSO when application accounts are enabled."
SEC-CAT-LMF-027,"The application must notify the system administrators and system security officers (ISSO) of account deactivation actions. The application must be configured to send notifications to the system administrator and the ISSO when application accounts are enabled."
SEC-CAT-LMF-028,"The application must notify the system administrators and the system security officers (ISSO) when application accounts are created."
SEC-CAT-LMF-029,"The application must notify the system administrators and system information security officers (ISSO) of account elimination actions. The application configuration must include notification to the system administrator and the ISSO when application accounts are deleted."
SEC-CAT-LMF-030,"The application must notify system administrators and system security officers (ISSO) when user accounts are modified."
SEC-CAT-LMF-031,"The application must provide functions to analyze records and audit traces to identify all users who have accessed or modified patient/people records during a certain period."
SEC-CAT-LMF-032,"The application must alert the Information Security Officer (ISSO) and the System administration (SA) in case of a failure in audit processing. The application must be configured to send an alarm when the audit system fails or is experiencing failure."
SEC-CAT-SRF-001,"The application must implement protection measures to prevent SSRF vulnerabilities, including network and application layer controls."

